{
  "identity": "meeting-follow-up:example-event",
  "status": "client_action_required",
  "current_step": {
    "code": "resolve_template",
    "type": "server",
    "operation": "automation.templates.resolve"
  },
  "error": {
    "code": "AUTOMATION_TEMPLATE_NOT_FOUND",
    "message": "No email template is configured for the requested follow-up.",
    "retryable": false,
    "correlation_id": "corr_example123456",
    "details": [{"purpose": "meeting_follow_up", "channel": "email"}]
  },
  "resolution": {
    "goal": "create_automation_template",
    "instruction": "Use the original request and authorized organization context to recommend a follow-up email template. Present its subject and content to the user and obtain permission before creating it.",
    "operation": "automation.templates.create",
    "requires_user_approval": true,
    "approval_scope": [
      "purpose",
      "channel",
      "subject",
      "content",
      "configured_storage_target"
    ],
    "after_success": {
      "verb": "step",
      "method": "POST",
      "href": "/bos/apps/lead-director/api/v1/organizations/org-example/journeys/meeting-follow-up%3Aexample-event/step?capability=cap_example123456",
      "payload_schema": null
    }
  }
}
